### ISSUE TITLE
应用pbr规则后机器无法ssh

### ISSUE THREAD

**Issue by ware-rs** [sskaje/ubnt-clash#12]
环境：
edgerouter lite 3
eth0: WAN  192.168.1.1
eth1: server pc  192.168.2.2
eth2: client pc   192.168.3.3

安装clash后，使用`curl https://rst.im/ip --interface utun -v` 测试clash正常工作。

按照下述操作后，client 无法ssh到server，请问是什么问题？

```
# 创建路由表
set protocols static table 10 interface-route 0.0.0.0/0 next-hop-interface utun

# pbr 规则
set firewall group address-group SRC_CLASH address 192.168.2.2
set firewall modify MCLASH rule 101 action modify
set firewall modify MCLASH rule 101 modify table 10
set firewall modify MCLASH rule 101 source group address-group SRC_CLASH

# 在 eth1 上应用 pbr 规则
set interfaces ethernet eth1 firewall in modify MCLASH
```

**Comment by sskaje** [comment]
1 看一下路由表

```
ip route show table 10
```

执行一下看看

2 从 client 持续 ping server，然后从路由分别对 eth1 和 eth2 对 icmp 抓包，存成pcap，用 Wireshark 对比看一下包的情况

**Comment by ware-rs** [comment]
> 1 看一下路由表
> 
> ```
> ip route show table 10
> ```
> 
> 执行一下看看
> 
> 2 从 client 持续 ping server，然后从路由分别对 eth1 和 eth2 对 icmp 抓包，存成pcap，用 Wireshark 对比看一下包的情况

1. 路由表

```
root@ubnt:~# ip route show table 10
default dev utun scope link 
```

2. 抓包
eth1: server 192.168.2.47
eth2: client 192.168.3.38
（机器直连交换机）

client ping server，路由器上抓包:
```
root@ubnt:~# tcpdump -nn -i eth1 icmp
tcpdump: verbose output suppressed, use -v or -vv for full protocol decode
listening on eth1, link-type EN10MB (Ethernet), capture size 262144 bytes
14:54:37.097852 IP 192.168.3.38 > 192.168.2.47: ICMP echo request, id 1, seq 17, length 40
14:54:37.098438 IP 192.168.2.47 > 192.168.3.38: ICMP echo reply, id 1, seq 17, length 40
14:54:41.749689 IP 192.168.3.38 > 192.168.2.47: ICMP echo request, id 1, seq 18, length 40
14:54:41.750286 IP 192.168.2.47 > 192.168.3.38: ICMP echo reply, id 1, seq 18, length 40
14:54:46.759703 IP 192.168.3.38 > 192.168.2.47: ICMP echo request, id 1, seq 19, length 40
14:54:46.760301 IP 192.168.2.47 > 192.168.3.38: ICMP echo reply, id 1, seq 19, length 40
14:54:51.759719 IP 192.168.3.38 > 192.168.2.47: ICMP echo request, id 1, seq 20, length 40
14:54:51.760193 IP 192.168.2.47 > 192.168.3.38: ICMP echo reply, id 1, seq 20, length 40

8 packets captured
8 packets received by filter
0 packets dropped by kernel
root@ubnt:~# tcpdump -nn -i eth2 icmp
tcpdump: verbose output suppressed, use -v or -vv for full protocol decode
listening on eth2, link-type EN10MB (Ethernet), capture size 262144 bytes
14:55:37.291964 IP 192.168.3.38 > 192.168.2.47: ICMP echo request, id 1, seq 21, length 40
14:55:42.259827 IP 192.168.3.38 > 192.168.2.47: ICMP echo request, id 1, seq 22, length 40
14:55:47.259834 IP 192.168.3.38 > 192.168.2.47: ICMP echo request, id 1, seq 23, length 40
14:55:52.246461 IP 192.168.3.38 > 192.168.2.47: ICMP echo request, id 1, seq 24, length 40
```

**Comment by sskaje** [comment]
1 路由表没有 `dev eth1 scope link`  和 `dev eth2 scope link` 这样的记录？

2 看着是 eth2 -> eth1 是通的，但是回包没回来，你可以手工加一下这两条路由试试

理论上，同时对 tun0 抓包，应该能看到 192.168.2.47 -> 192.168.3.38 的 icmp 

参考命令
```
ip route add 192.168.2.0/24 dev eth1 scope link table 10
ip route add 192.168.3.0/24 dev eth2 scope link table 10
```

**Comment by ware-rs** [comment]
> 1 路由表没有 `dev eth1 scope link` 和 `dev eth2 scope link` 这样的记录？
> 
> 2 看着是 eth2 -> eth1 是通的，但是回包没回来，你可以手工加一下这两条路由试试
> 
> 理论上，同时对 tun0 抓包，应该能看到 192.168.2.47 -> 192.168.3.38 的 icmp
> 
> 参考命令
> 
> ```
> ip route add 192.168.2.0/24 dev eth1 scope link table 10
> ip route add 192.168.3.0/24 dev eth2 scope link table 10
> ```

1. 确实没有，只有一条记录。

2. 晚上回去试下，感谢

**Comment by ware-rs** [comment]
加上两条路由后，可以了，感谢。
请问哪里有cli对于这些设置语法的说明文档呢？官方的pdf文档只有界面如何设置以及简单命令行设置，但是没有完整的语法说明。官方论坛也是告诉实现pbr该怎么设置，但没有详解命令帮助，虽然看语句能猜个大概。

**Comment by sskaje** [comment]
> 加上两条路由后，可以了，感谢。

参考你的命令，加interface route，效果等同这个命令

> 
> 请问哪里有cli对于这些设置语法的说明文档呢？官方的pdf文档只有界面如何设置以及简单命令行设置，但是没有完整的语法说明。官方论坛也是告诉实现pbr该怎么设置，但没有详解命令帮助，虽然看语句能猜个大概。

没有，只能看提示。
我以前blog写了pbr的分析，然而硬盘挂了，可能web archive还能找到快照

**Comment by ware-rs** [comment]
感谢指点。web archive 里面发现以前blog有很多ubnt路由器的文章，先学习一波
